title,story
Sensational: Hungarian Junior Handball Team triumphs at World Championship! | Daily News Hungary,france-football
World Cup afterglow gives France a sorely needed boost,france-football
"World Cup final 2018: The sad story of Ivan Perisic, today's decisive player but not always in the way he might want",france-football
LIVE| FIFA World Cup 2018 final: History awaits Croatia in summit clash vs France,france-football
VAR used for first time in World Cup final,france-football
"Names &amp; Faces: Kate Upton, Emmanuel Macron - SFGate",france-football
World Cup celebrations rock France,france-football
French and Croatian heads of state greet each other before World Cup Final (PHOTOS),france-football
Lineker urges Barcelona to break bank for 'perfect' Chelsea star | teamtalk.com,france-football
World champion teenager Mbappe is game's new global star,france-football
"Trump lists Russia, EU, China as 'foes'ahead of Putin summit",france-football
"History, revenge, injured stars...final has it all | Northern Star",france-football
"Lenin statue at final sandwiched by ads for Budweiser, Visa",france-football
"Young, joyful France beats Croatia 4-2 to win 2nd World Cup",france-football
France are World Cup champions,france-football
"Paul Pogba, Kylian Mbappe, Antoine Griezmann and victorious France stars pose with World Cup",france-football
Pussy Riot announce two brand new songs,france-football
Trump Refuses to Denounce Russian Meddling In the 2016 election in Press Conference with Vladimir Putin,france-football
"Trump Unleashes New Attacks on US Media, Democrats",france-football
World Cup tops and flops,france-football
World Cup celebrations rock France; ‘Les Bleus’ victory parade set for Champs Elysees,france-football
Pogba followed up his own shot to put France two goals to the good,france-football
World Cup Finals: Pamela Anderson & More Hot Girlfriends & Wives Of France & Croatia Players,france-football
"Canadian soccer fans brace for World Cup final between France, Croatia",france-football
"With flags, song, pride, French celebrate unifying victory",france-football
Huawei P20 Lite review: Cheap and gorgeous Moto G6 alternative - CNET - Crosat - News from the entertainment and multimedia,france-football
Great racing on the horizon as the Qatar Goodwood Festival is looked forward to - Racenews,france-football
FIFA WC 2018 Final: 5 Key Moments From France’s Win Over Croatia,france-football
Chelsea transfers: Monaco confident of doing Aleksandr Golovin deal today | Metro News,france-football
Pussy Riot Says Its Members Ran Onto the Field in World Cup Final - The New York Times,france-football
The Big Match Tactical View: France v Croatia,france-football
The Latest: Macron makes the most of France's World Cup win,france-football
"Brilliant Mbappé, insane Varane, and a Floyd Mayweather spirit..",france-football
France lift World Cup for a second time after victory over Croatia and celebrate with Icelandic ‘Thunder Clap’ as Antoine Griezmann is left in tears and Paul Pogba makes a beeline for his brothers – Xplorer,france-football
Coupe du monde » acutalités » Paris renames metro stations to honour World Cup stars,france-football
WORLD CUP: Winners and losers of the tournament in Russia,france-football
World Cup winners France provide flair and panache to cast aside pragmatic image,france-football
Reaction after France beat Croatia 4-2 in the World Cup final,france-football
Trump congratulates Putin on hosting the World Cup: 'one of the best ever!',france-football
"FIFA World Cup 2018: French President Emmanuel Macron cheers from stands, ‘dabs’ with players",france-football
Clinton trolls Trump ahead of Putin summit with World Cup tweet,france-football
"Real Madrid transfer news: Mbappe, Hazard, Courtois, Kane",france-football
France easily defeats Croatia to be crowned FIFA 2018 winner,france-football
14/07 Top 10 news of the day: Chelsea sign Sarri and Jorginho as Hazard's future is in doubt...,france-football
World Cup 2018: Pride and tears for Croatians after World Cup final loss,france-football
What Would a World Cup Win for France Mean in the French Caribbean? | Scissors Kick,france-football
"Vive le France! And a lot of other nations, too",france-football
AP News in Brief at 6:04 a.m. EDT,france-football
Croatian leader hands Putin soccer shirt before World Cup final,france-football
"France wins 2nd World Cup title, beats Croatia 4-2",france-football
Thailand’s rescued cave boys won’t see World Cup final live,france-football
Morning Update: Trump Continues His International Man Of Mystery Tour,france-football
Croatia gears up to give heroes' welcome to World Cup team,france-football
Two Die After Celebrations in France Over World Cup Win Turn Violent - Reports,france-football
Still have World Cup fever? Soccer's biggest teams come to the United States in International Champions Cup,france-football
"World Cup win gives France new set of heroes, needed boost",france-football
France’s World Cup champions arrive in Paris,france-football
No refuge from politics but France victory a fitting climax,france-football
Macron to welcome French football team at Elysee Palace,france-football
China firm to refund $12 million after France World Cup win,france-football
Deschamps’ World Cup win a triumph for substance over style,france-football
World Cup afterglow gives France a sorely needed boost,france-football
Olivier Giroud ‘privileged’ to be part of French team and to silence critics,france-football
World Cup celebration in Paris is the most jubilant sh*t we've ever seen,france-football
The Latest: 4 pitch invaders disrupt World Cup final,france-football
Reuters photographers pick their best World Cup shots,france-football
"From Ranveer Singh to Abhishek Bachchan, celeb fans hail France winning World Cup",france-football
Dalic: Croatia showed that small nations can dream,france-football
France Wins Second World Cup Title,france-football
"What a good weekend, guys.... Belgium gets the bronze medal, Kaiser Chiefs FC wins the Maize Cup.....and France top it up by winning the WORLD CUP!!!! MAKHOSI!!!!!",france-football
Belgium squad handed hero's welcome on #WorldCup return,france-football
Missing the World Cup already? A guide to the 2022 finals in Qatar | South Wales Guardian,france-football
"Hopeful fans gather in Paris, willing 'Les Bleus'to World Cup victory",france-football
Six players to watch in the World Cup final,france-football
Two die celebrating France's World Cup 2018 win over Croatia,france-football
"FIFA World Cup: Final schedule, TV time and storylines for Croatia vs. France",france-football
The Latest: Croatian president asks Russia to back her team,france-football
Italy’s Salvini doesn’t exclude EU veto on Russia sanctions,france-football
It’s Coming Home – Bring Coffee,france-football
France fans pack Champs Elysees in Paris to get glimpse of World Cup winners,france-football
"MOSCOW | Vive le France! And a lot of other nations, too - FeedPublish",france-football
World Cup 'just the beginning'for Mbappe-led France,france-football
The Latest: France clinches World Cup with win over Croatia,france-football
"‘Thank you, heroes’ – press hail Croatia squad :: Bestnaira.com",france-football
TV Celebs Attend Screening Of Fifa World Cup 2018 Finale | Freegameslab.com,france-football
‘They didn’t play football’: Lovren’s salty France dig | Coolum & North Shore News,france-football
World Cup afterglow lifts up conflicted France - Times Union,france-football
"More than 250,000 welcome Croatia home after World Cup final",france-football
Fans lash Antoine Griezmann for alleged act of deceit that turned the World Cup final,france-football
The Latest: Fans flying flags at World Cup final stadium,france-football
World Cup | HarsH ReaLiTy,france-football
The Latest: Perisic equalizes for Croatia in World Cup final,france-football
France vs Croatia World Cup Live Stream: How to Watch,france-football
Party begins as delirious French revel in World Cup victory,france-football
France winger Kylian Mbappe wins Sky Sports World Cup Power Rankings,france-football
Soccer: France overpower Croatia 4-2 to win World Cup,france-football
Juventus get ready as Cristiano Ronaldo set to be unveiled by Serie A champions on Monday,france-football
Nyanza-Kisii,france-football
Croatia stages huge celebration for biggest soccer success ever,france-football
The Latest: French leader to soccer team: 'Don't change',france-football
"Deschamps joins Zagallo, Beckenbauer as champ player, coach",france-football
The Latest: French soccer team gets hero's welcome in Paris,france-football
Trump-Putin Summit: Donald Trump Defends Russia over Claims of Election Interference - BelleNews.com,france-football
World Cup Illustrations and World Cup Posters Capture the Event's Excitement,france-football
-Croatia fly flag for the little guys - Football - Eurosport Australia,france-football
Is the United States a soccer nation?,france-football
Young France triumph and promise even more to come,france-football
France kick off against Croatia,france-football
The Latest: Embankment near stadium in Volgograd gives way,france-football
"Vive la France! And a lot of other nations, too",france-football
"France win FIFA World Cup for second time, beat Croatia 4-2",france-football
France clinches World Cup with win over Croatia,france-football
"5 things for July 16: Trump and Putin, North Korea, World Cup",france-football
Brutal chart shows how much more efficient France was than Croatia in the World Cup Final,france-football
Novak Djokovic wins 4th Wimbledon title after beating Kevin Anderson in straight sets,france-football
West Bengal's Chandannagar celebrate's France's World Cup win,france-football
Five things we learned from the 2018 World Cup final,france-football
France Wins World Cup,france-football
England captain Harry Kane wins Golden Boot as World Cup ends,france-football
Auto,france-football
"France beat Croatia to win second World Cup as Pogba, Mbappe star",france-football
France wins FIFA World Cup title for the second time after beating Croatia by 4-2; Google joins celebrations with a doodle,france-football
ترامب وأوزيل والفيفا يهنئون فرنسا بالفوز بكأس العالم | Goal.com,france-football
"'Makkah Road Initiative' launched; relief for Haj pilgrims from Malaysia, Indonesia | ummid.com",france-football
Fans proud despite Croatia's World Cup final loss to France,france-football
World Cup final: How football world reacted to France's win over Croatia,france-football
"Deschamps joins Zagallo, Beckenbauer as champ player, coach",france-football
"We were better team, but penalty decision ‘killed’ us, admits Modric | Croydon Guardian",france-football
Our Network Sites,france-football
Thai cave rescue boys promise to be 'good boys' as they mourn diver who died helping to save them World news in pictures Independent News Email Notifications Vote Report Comment Delete Comment Reply,france-football
The Latest: Croatia PM says fans rejoice despite Cup loss,france-football
World Cup highs and lows: From Mbappe to Lopetegui and everything in between | Ilkley Gazette,france-football
The Latest: Putin passes torch to Qatar for World Cup 2022,france-football
"France wins 2nd World Cup title, beats Croatia 4-2",france-football
Plans for 2021 World Cup taking shape on and off the field | Penarth Times,france-football
"France wins 2nd World Cup title, beats Croatia 4-2",france-football
Samoa down Germany to clinch 2019 World Cup spot,france-football
"US trade, immigration and biofuel policies hit farmers hard - World  news - NewsLocker",france-football
France or Croatia: Bollywood roots for FIFA World Cup favourites,france-football
No refuge from politics but France victory a fitting climax,france-football
Missing the World Cup already? A guide to the 2022 finals in Qatar | Wharfedale Observer,france-football
Allez Allez Bleus! France Edge Gallant Croatia To Win Second World Cup Title,france-football
The Latest: France takes 1-0 lead on Croatia own goal International National Most Popular Lo Más Popular,france-football
BC-World Cup Advisory,france-football
"FIFA World Cup 2018 finals: Clashes, road accidents mar French World Cup celebrations",france-football
France Begins Party After World Cup Victory,france-football
Russian women push back at shaming over World Cup dating,france-football
World Cup triumph afterglow raises French spirits,france-football
Egypt Team Ranked 2nd Worst Following Panama in World Cup  | Al Bawaba,france-football
France vs Croatia: 5 things we learned from the FIFA World Cup final,france-football
"FIFA World Cup Final: Putin shows who’s the boss, all he needs is an umbrella",france-football
"Spieth returns claret jug, faces tough task getting it back",france-football
Το Παρίσι… φλέγεται μετά το Μουντιάλ,france-football
France lift second World Cup after winning classic final 4-2,france-football
Russia Soccer WCup France Croatia,france-football
Croatia gripped by anticipation ahead of final with France,france-football
France Begins Party After World Cup Victory,france-football
World Cup team of the tournament | Evening Times,france-football
"You should be proud despite defeat, Croatia coach tells players",france-football
"Ronaldinho, Will Smith shine in World Cup closing ceremony – Canindia News",france-football
SORE LOSER Liverpool defender Dejan Lovren slams France tactics after Croatia’s World Cup final defeat,france-football
Dalic: Croatian players will sacrifice places if not fit,france-football
The Warm-Up: Allez les Bleus! (Part Deux),france-football
How the World Cup final between France and Croatia will be won,france-football
The Latest: Fans gather in rainy Zagreb to watch World Cup,france-football
"France wins 2nd World Cup title, beats Croatia 4-2",france-football
Vintage Paul Pogba comes of age to ensure Didier Deschamps delivers France's World Cup destiny - World Cup 2018 - Football - Eurosport Australia,france-football
Pussy Riot claims on-field protest at World Cup final,france-football
France beat Croatia in thrilling World Cup final to win second title,france-football
"5 things for July 16: Trump and Putin, North Korea, World Cup",france-football
The Latest: Pele praises French teenager Mbappe at World Cup,france-football
U.S. President Trump has 'low expectations'for Helsinki summit,france-football
World Cup 2018: Standout stats from the tournament in Russia,france-football
World Cup winners France begin victory parade - Daily Nation,france-football
France claim second World Cup title with thrilling 4-2 win over Croatia (10) - People's Daily Online,france-football
Shameful lesson of the African migrant crisis,france-football
Hvper News – One Page Internet,france-football
READ MORE: France take the World Cup but you can’t kill Croatian pride,france-football
France’s promise of improvement: Didier Deschamps’ side could become era-defining - World Cup 2018 - Football - Eurosport Australia,france-football
France Wins World Cup,france-football
2018 FIFA World Cup winner and France defender Adil Rami 'proud' of African descent - News - Kick Off,france-football
The Latest: France clinches World Cup with win over Croatia,france-football
Ferdinand: France have fantastic opportunity to dominate after winning World Cup,france-football
fbl-WC-2018-FRA-BEL-ENG-television-ThierryHenry,france-football
Croatia boss echoes Luka Modric claims and says England media showed disrespect ahead of semi-final – Ireland,france-football
Rain can't put a damper on Bound Brook's World Cup celebration,france-football
England captain Harry Kane wins Golden Boot as World Cup ends,france-football
World Cup 2018: Dejan Lovren critical of referee and insists Croatia were better than France,france-football
RUSSIA SOCCER FIFA WORLD CUP 2018,france-football
Home: Hyderbabad engineer lynched by mob in Karnataka on suspicion of being child lifter,france-football
Russia on a high as World Cup wraps; Putin's problems remain,france-football
Video: France’s ambassador to Oman talks about the country’s World Cup win,france-football
Dog dies from saltwater poisoning,france-football
'On Top Of The World': France Wins World Cup,france-football
France and Croatia announce line-ups for World Cup final | The World Game,france-football
France Defeats Croatia: A Recap Of The 2018 World Cup,france-football
France fans pack Champs Elysees in Paris to get glimpse of World Cup winners,france-football
"Congress And Twitterverse Up In Arms As Puducherry Lt Governor Kiran Bedi Celebrates France's World Cup Win By Saying ""We Won""",france-football
England’s Harry Kane in 2018 and the Best Young Players in World Cup History,france-football
World Cup ‘just the beginning’ for Mbappe-led France,france-football
2018 FIFA World Cup | Luka Modric scoops Golden Ball to join elite company,france-football
PHOTOS: France overpower Croatia to win second World Cup,france-football
Kylian Mbappe features as L'Equipe publish photos of France squad from 20 years ago,france-football
Photos: France celebrates World Cup victory – Daily News,france-football
Uruguay star on Cherries radar,france-football
World Cup: Sharp finishing seals third spot for Belgium,france-football
"World Cup win gives France new set of heroes, needed boost",france-football
"Column: At World Cup final, Mbappe, just 19, joins Pele",france-football
This Is What You Do When You Lose The World Cup Final | Balls.ie,france-football
"FIFA World Cup 2018: Croatia frustrated with VAR, former players fired heavily on penalties – Corners360",france-football
Sky Sports News reporter rules out Man United selling Paul Pogba,france-football
FIFA awards for 2018 World Cup. Who's won what?,france-football
Unusual Things To Do In Paris,france-football
Five similarities between the 2018 and 2002 World Cups,france-football
"France wins 2nd World Cup title, beats Croatia 4-2",france-football
France vs Croatia World Cup Final: Fantasy XI,france-football
France wins second World Cup title after high-scoring victory over Croatia,france-football
Croatia gears up to give heroes’ welcome to World Cup team | Northwich Guardian,france-football
"France ""in a bubble"" for Cup final: Lloris | Central Western Daily",france-football
Health Politics,france-football
France hero Griezmann 'can't wait' to take World Cup home | Sport24,france-football
France down Croatia in World Cup thriller,france-football
World cup kickoff: A look at the World Cup's final day,france-football
"From Paris to Moscow, France fans go wild after thrilling World Cup win",france-football
"France wins 2nd World Cup title, beats Croatia 4-2",france-football
"Usain Bolt A-League, Central Coast Mariners, transfer news, updates, video | Gold Coast Bulletin",france-football
Young World Cup Star Gives Away Winnings,france-football
Big Match Breakdown | World Cup Final | France v Croatia |,france-football
The Latest: Perisic equalizes for Croatia in World Cup final,france-football
The Latest: Croatia arrives at stadium for World Cup final,france-football
Russia to keep visa-free entry for football fans till end of 2018 — Putin,france-football
"France wins 2nd World Cup title, beats Croatia 4-2",france-football
The Latest: French soccer team gets hero's welcome in Paris,france-football
Macron cheers from the stands -- then 'dabs'in the changing room,france-football
Final match of the FIFA World Cup,france-football
"PHOTOS Paris Fanzone Filled with 90,000 ‘Les Bleus’ Cheer France to World Cup Victory",france-football
The Latest: France clinches World Cup with win over Croatia,france-football
SportsJOE's World Cup team of the tournament,france-football
Alexis Sanchez unable to travel to USA with Manchester United due to visa issues,france-football
France are worthy World Cup winners after seeing off Croatia,france-football
Deschamps hails France ‘mental strength’,france-football
France defeats Croatia to win 2018 World Cup,france-football
Pele v Kylian Mbappe: Tale of the tape | Penarth Times,france-football
Jubilee leaders differ over rift talk,france-football
"History, revenge, injured stars...final has it all | Gympie Times",france-football
Croatia stages huge celebration for biggest soccer success ever | Reuters,france-football
"Fifa World Cup: France and Croatia fans gear up to watch Moscow final in Hong Kong, communities coming together for a ‘common dream’",france-football
Authorities investigating pitch invasion protest during World Cup final,france-football
Mad Scenes In Dublin As Euphoric French Supporters Stop Traffic | Balls.ie,france-football
Ante Rebic 'wanted by Manchester United' as Jose Mourinho considers £44m bid for Croatia forward - Mirror Online,france-football
French celebrate unifying victory,france-football
"5 things for July 16: Trump and Putin, North Korea, World Cup",france-football
France wins second World Cup in classic final,france-football
Vive la France! Presidential dabs and a party in Paris,france-football
France storms to second World Cup title with final victory over Croatia,france-football
Antoine Griezmann dive sets up French goal in World Cup final,france-football
Macron cheers from the stands -- then 'dabs'in the changing room,france-football
"Clashes, road accidents mar World Cup celebrations in France",france-football
France Wins the World Soccer Cup Final over Croatia 4-2….,france-football
The Latest: French soccer team gets hero's welcome in Paris,france-football
Michelle Obama Dances Like Nobody's Watching at Beyonce and JAY-Z's Concert in Paris,france-football
France caps a frenetic and fabulous World Cup by blazing past Croatia for the title - Washington Post,france-football
The Latest: Croatia's Mandzukic kicks off World Cup final National Most Popular Lo Más Popular AP National News Video,france-football
I hope to sleep with the cup! - Griezmann excited for triumphant return to France,france-football
"Here’s How These Caribbean-Roots, French Players Are Reacting To Their World Cup Win",france-football
‘They didn’t play football’: Lovren’s salty France dig | Balonne Beacon,france-football
"France Wins World Cup, Beat Croatia",france-football
Fox Coverage Of France-Croatia World Cup Final - One News Page VIDEO,france-football
"With flags, song, pride, French celebrate unifying victory",france-football
Heartbroken but proud Croatia fans celebrate their 'heroes',france-football
The real reason N'Golo Kante came off during France's World Cup win | Metro News,france-football
Belgium squad handed hero's welcome on World Cup return | Reuters,france-football
Croatia return home to a rapturous welcome | South Wales Guardian,france-football
The Latest Sign Of The Times As Stadium Changes For Final,france-football
"Trump lands in Helsinki, slams media for Russian policy | Business Standard News",france-football
"With flags, song, pride, French celebrate unifying victory - wave3.com-Louisville News, Weather & Sports",france-football
FIFA World Cup 2018: France Hero Griezmann 'Can't Wait' to Take Cup Home,france-football
The winner of the World Cup of Travel: Spain,france-football
"With flags, song, pride, French celebrate World Cup victory",france-football
Deschamps tells World Cup-winning France squad life will never be the same again | Sutton Guardian,france-football
Modric wins WC Golden Ball,france-football
Decision that ruined the World Cup final,france-football
The Latest: France takes 1-0 lead on Croatia own goal,france-football
Plans for 2021 World Cup taking shape on and off the field,france-football
France vs. Croatia: The Smokin' Hot WAGS of the World Cup Final,france-football
Record-low UK TV audience for World Cup final | East London and West Essex Guardian Series,france-football
"Spasiba Russia, see you in Qatar",france-football
Africans adopt a France team with a familiar feel,france-football
How would World Cup glory speak to a new generation of French fans? - footytube,france-football
Soccer-Pitch invaders halt World Cup final briefly,france-football
World Cup moment of truth for finalists,france-football
China firm to refund $12 million after France World Cup win,france-football
Argentine press rips national team coach Sampaoli as he heads for the exit,france-football
"Russia: Not so much a bear, more of a pleasant surprise (Analysis)",france-football
UPDATE 1-World Cup pitch intruder jailed for 15 days,france-football
Croatia players will sacrifice places  if not fit: Dalic,france-football
"Politics guide Syrians backing Croatia in World Cup final - wistv.com - Columbia, South Carolina",france-football
Didier Deschamps: France showed 'mental quality'against Croatia to win World Cup,france-football
Croatia Midfielder Modric Wins Golden Ball Award at 2018 FIFA World Cup,france-football
Romania: 18 wedding guests hurt in restaurant floor collapse,france-football
France and Croatia seek World Cup glory,france-football
Plans for 2021 World Cup taking shape on and off the field | Borehamwood Times,france-football
"Vive le France! And a lot of other nations, too",france-football
France celebrate in Paris after World Cup win in Russia | Halstead Gazette,france-football
Home QBullet: France Lifts FIFA World Cup; PM Modi Slams Opposition,france-football
"Vive le France! And a lot of other nations, too",france-football
No refuge from politics but France victory a fitting climax,france-football
Griezmann happy if France win World Cup 'ugly',france-football
"With flags, song, pride, French celebrate World Cup victory",france-football
The Latest: Sign of the times as stadium changes for final,france-football
The Latest: Croatia arrives at stadium for World Cup final,france-football
"How France beat Croatia to win second World Cup as Pogba, Mbappe star",france-football
"France wins World Cup, adds another star | MENAFN.COM",france-football
