title,story
"It was always going to be Brexit in name only, don't forget she said in the commons it was either this deal, no deal or no Brexit, she wants the latter.",may-deal
UK's Brexit Secretary Raab resigns thrusting May's government into turmoil | Reuters,may-deal
Brexit threatened as four UK ministers quit,may-deal
Uncertainty fuelling opportunity debated at Lincolnshire landowners seminar,may-deal
"Asia edges up as oil slide slows; pound, euro firm on Brexit optimism | ZAWYA MENA Edition",may-deal
EU and Britain start on campaign to sell Brexit deal,may-deal
South Africa’s ‘Own Brexit’ Forgotten as Pound Tumbles Versus Rand,may-deal
May shaky as Brexit deal opposition grows | The Star,may-deal
British public awaits decision of Parliament on Brexit deal,may-deal
The Latest: May to try to sell Brexit deal to lawmakers,may-deal
Iceland’s President Apologises For Saying Pineapple Pizza Should Be Banned,may-deal
Resignations over Brexit deal rock UK govt,may-deal
Leading Pro-Brexit MP To Submit Letter Of No-confidence In British PM: Spokesman,may-deal
Great Portland Estates: Half Year Results 2018 – Strong Operational Performance,may-deal
"UPDATE 1-Property firms Bovis, Great Portland flag Brexit uncertainties",may-deal
Pound plummets as ministers quit UK government,may-deal
Local politicians give their reaction to Brexit bill,may-deal
May vows to ‘see this through’ amid furious backlash to Brexit plan,may-deal
Government resignations spark pound sell-off | Oxford Mail,may-deal
Dominic Raab resigns as Brexit Secretary - ITV News,may-deal
What Does The Proposed Brexit Withdrawal Deal Mean For The Tech Industry,may-deal
EU workers leave UK in record numbers as Brexit looms,may-deal
How the latest Premier League summit could affect Jurgen Klopp's Liverpool,may-deal
Brexit: Where Raab and McVey go wrong over threat to Union – Tory MSP,may-deal
DUP leader Arlene Foster has said she had a 'frank' meeting with Theresa May over the Brexit deal,may-deal
May shaky as Brexit deal opposition grows | Bunbury Mail,may-deal
UK’s May battles to save her Brexit deal and her job,may-deal
"SociaIist Voice@SocialistVoice 3 hours ago Lib Dem MP Stephen Lloyd has said he will back Theresa May’s abysmal Brexit deal, which will remove the UK from the EU with none of the advantages of leaving while retaining almost all of the obligations of member",may-deal
London open: Miners pace the advance as May faces Commons backlash,may-deal
Labour says PM May has no authority after latest resignation,may-deal
Has Theresa May got the numbers for her Brexit plan? | Cotswold Journal,may-deal
The Latest: May loses another Cabinet minister over Brexit,may-deal
Britain is still preparing for no-deal Brexit - PM May,may-deal
Theresa May is the only fan of her own draft Brexit deal,may-deal
Stocks mostly rise but Europe weighed down by Brexit discord,may-deal
Daily Express deputy editor says he feels 'slightly responsible'for current political chaos due to paper's Brexit stance,may-deal
The Latest: Top Brexit supporter backs no confidence in May,may-deal
Huge blow for May as Esther McVey joins Dominic Raab in resigning over Brexit deal,may-deal
Brexit: Does the withdrawal agreement 'take back control'?,may-deal
"US STOCKS-Wall Street hit by weak earnings, Brexit concerns",may-deal
Belgium: EU and UK to finalise Brexit deal on November 25 — Tusk,may-deal
UK-6THLDALL-BREXIT,may-deal
10 Things to Know for Today,may-deal
Brexit secretary goes as insurance industry reaction to deal pours in,may-deal
News,may-deal
Airbus says Brexit deal is a welcome step but much work to do,may-deal
"Asian stocks higher after Wall Street fall, Brexit approval",may-deal
Wayne Rooney earned his England send-off against USA at Wembley,may-deal
The Latest: EU Parliament's top Brexit official backs deal,may-deal
A guide to where we are with Brexit,may-deal
Behind the process: emulsifiers and blending,may-deal
"Economic troubles, Brexit and trade wars may affect travel companies, executives warn",may-deal
UK's May wins cabinet backing for Brexit deal,may-deal
CURRENCIES: Pound Plunges More Than 1.5% Against The Buck Amid Turmoil Over May's Brexit Plan,may-deal
May defiant as senior Tories resign over her Brexit agreement,may-deal
A leading Brexiteer just threatened May's leadership,may-deal
Two British ministers resign over Brexit in blow to May,may-deal
Theresa May to hold press conference as Gove reportedly offered Brexit Secretary job,may-deal
Will Brexit happen?,may-deal
‘Sit down you old twerp!’ Brigden’s question to PM shot down by Tories,may-deal
Brexit was gone a while ago....,may-deal
UK's May takes Brexit deal to rebellious MPs,may-deal
Business Highlights,may-deal
Concern In Clare About What Could Emerge From Brexit Talks - Clare FM,may-deal
Will Raab and McVey's resignations spark a chain reaction?,may-deal
It is now clear to all who look: Brexit is a humiliation of historic proportions,may-deal
"All our Dystopias Now: Climate Crisis, Plutocracy and Hyper-Nationalism",may-deal
"Global Markets Keep on Plunging Despite Oil Rises, Asia Stocks Trade with Mix Sentiment",may-deal
U.K. Wracked By Political Turmoil As Top Ministers Reject Draft Brexit Deal,may-deal
"Police Federation: No-deal Brexit could lead to disruption, danger, delays and rationing",may-deal
"Retailers, homebuilders lead early slide in US stocks",may-deal
"In other words, there was no point in moving openly against May until she’d come up with something to oppose, and therefore the Brexit camp could pitch a coherent alternative to their party and electorate. It hardly takes Macchiavelli to figure that out.",may-deal
European Update: UK and Sterling in turmoil on ministers resignations,may-deal
Theresa May's premiership is now rapidly running out of road,may-deal
"Amid resignations, UK PM Theresa May says it is her draft or 'no Brexit'",may-deal
"Asia edges up as oil slide slows; pound, euro firm on Brexit optimism | Reuters",may-deal
Brexit deal: Watch Theresa May's statement to MPs in full after key cabinet resignations - One News Page [US],may-deal
Final stage of May’s torturous Brexit journey lies ahead,may-deal
UPDATE 1-British junior minister quits May's government,may-deal
EU divorce deal thrown into doubt as Brexit minister resigns,may-deal
European Union Parliament Backs Ban on Single-Use Plastics,may-deal
How Theresa May's Brexit Deal Can Get Through Parliament - We Did The Maths,may-deal
EU divorce deal in peril after two UK Cabinet ministers quit,may-deal
British PM May fights to save Brexit deal and her job,may-deal
"British government shatters, mass resignations over Brexit",may-deal
"Of course they do, split the Brexit vote between my deal and no deal while no Brexit wins.",may-deal
HIGHLIGHTS-British ministers quit over draft Brexit deal,may-deal
British government approves draft Brexit deal,may-deal
MSPs to vote on Brexit deal before House of Commons | Penarth Times,may-deal
Britain's Labour Party says PM May has no authority after latest resignation,may-deal
UK: May's leadership under threat as Brexit bill stalled,may-deal
May vows to fight for her Brexit deal,may-deal
Zebra Technologies Rugged Tablets Receive New Network Certifications,may-deal
ECF: Unlikely UK will move away from Solvency II requirements after Brexit,may-deal
LONDON MARKET EARLY CALL: Stocks Seen Flat; Cabinet Backs Brexit Plan,may-deal
Renewed hopes for new Brexit vote amid draft deal backlash,may-deal
Italy maintains spending plans despite threat of EU censure,may-deal
UPDATE 1-Brexit accord leaves British finance out in the cold,may-deal
Here's who has resigned from the Conservative party so far,may-deal
Japan's SoftBank invests in US office space-sharing WeWork,may-deal
EU Sets Nov. 25 as Summit Day to Endorse Brexit,may-deal
GLOBAL MARKETS-Sterling dives on Brexit uncertainty; Wall St erases losses,may-deal
"Who knows what Labour are supporting these days. As for the SNP, why shouldn't the Scottish Government support an outcome that benefits Scotland and would mitigate some of the damage that Brexit (in all forms) would inflict on the country.",may-deal
"FOREX-British Brexit turmoil spooks investors, boosts dollar, yen",may-deal
Brexit fallout LIVE: Theresa May faces turmoil as Ministers resign,may-deal
The Latest: UK's Brexit minister quits over deal with EU,may-deal
French PM Philippe: We have to be ready for 'no-deal' Brexit | Reuters,may-deal
Tech Leads Stocks Higher as Brexit Turmoil Weighs: Markets Wrap - SWI swissinfo.ch,may-deal
Tory MPs urged by Rees-Mogg to reject May’s Brexit plan | Clacton and Frinton Gazette,may-deal
"Brexit was a run to tune the system for the election of our Glorious Leader! Remember how Leader, during the campaign, said how his election will be like Brexit? To convince the voters to make protest votes, to wake the next morning wondering what we've do",may-deal
EU Sets Nov. 25 as Summit Day to Endorse Brexit,may-deal
10 Things to Know for Today,may-deal
May gets backing from cabinet for Brexit deal,may-deal
Dow ends four-day losing streak as stocks finish higher in choppy session,may-deal
LibDem MP: “I will back May’s deal” | The SKWAWKBOX,may-deal
"Retailers, homebuilders lead early slide in US stocks",may-deal
10 Things to Know for Today,may-deal
"Retailers, homebuilders lead early slide in US stocks",may-deal
UK's May battles to save her Brexit deal and her job,may-deal
Technology companies lead afternoon rebound for US stocks,may-deal
Government in crisis as ANOTHER minister quits,may-deal
АА: Germany welcomes draft Brexit deal,may-deal
"Asian stocks higher after Wall Street fall, Brexit approval",may-deal
"Brexit-sensitive stocks battered on deal backlash, exporters gain",may-deal
Brexit live: Raab and McVey quit as May prepares to update Commons | Times Series,may-deal
It's too early to breathe a sigh of relief on Brexit - Germany's DIHK,may-deal
Dominic Raab leads next Conservative leader odds but Corbyn favourite to be next PM | Metro News,may-deal
HIGHLIGHTS-British ministers quit over draft Brexit deal,may-deal
Brexit draft deal: The key points explained,may-deal
"LIVE MARKETS-Market gyrates on Brexit drama, STOXX at 2-week low",may-deal
The EU is not a buffet: How Britain and Europe’s papers reacted to Brexit plan | Falmouth Packet,may-deal
Brexit Draft Deal Agreed by Cabinet - but Parliament's Approval Remains Unlikely,may-deal
RBS Tumbles Most in Two Years on Risk of Labour Government,may-deal
The Latest: Top Brexit supporter backs no confidence in May,may-deal
EU divorce deal thrown into doubt as Brexit minister resigns,may-deal
British PM May battles to save Brexit deal as ministers quit,may-deal
EU sets Nov. 25 as summit day to endorse Brexit,may-deal
BELGIUM EU TREATIES BREIXT,may-deal
"GLOBAL MARKETS-Sterling dives on Brexit uncertainty, world stocks down for sixth day",may-deal
Brexit: EU's Barnier warns of'long road ahead',may-deal
UK Ministers resign over Prime Minister May’s deal to leave EU - One News Page [US],may-deal
European Union Parliament Backs Ban on Single-Use Plastics,may-deal
Has Theresa May got the numbers for her Brexit plan?,may-deal
The Latest: May loses more ministers over Brexit,may-deal
What is the Brexit deal? The UK public’s Google questions answered | Crewe Guardian,may-deal
"Riots, death and recession: Brexit's nightmare scenario",may-deal
People Living with HIV: Take the ‘Good Health Is More Than Health Care’ Quiz!,may-deal
UK ministers back May on Brexit amid rift | The Wimmera Mail-Times,may-deal
"Global stocks higher after Wall Street fall, Brexit approval",may-deal
May vows to fight for her Brexit deal,may-deal
Come What Maple,may-deal
"Brexit: I am going to see this through, says Theresa May",may-deal
EU divorce deal thrown into doubt as Brexit minister resigns,may-deal
"US stock indexes are mixed as retailers, homebuilders slide",may-deal
Ambitious climate change target proposed for Manchester,may-deal
FF hit out a Varadkar for claiming victory on Brexit deal,may-deal
Theresa May facing one of her toughest moments as prime minister,may-deal
Resignations over Brexit deal rock UK govt,may-deal
UK Car Industry Body Says Brexit Deal Is Only the First Step,may-deal
"Trusts sent IT security patch that would have protected them, says NHS Digital (From Penarth Times)",nhs-cyber-attack
Health Secretary Jeremy Hunt was warned LAST YEAR that the NHS is vulnerable to cyber attacks Do you want to automatically post your MailOnline comments to your Facebook Timeline? Do you want to automatically post your MailOnline comments to your Facebook ,nhs-cyber-attack
5 Emergency Mitigation Strategies to Combat WannaCry Outbreak,nhs-cyber-attack
Thousands turn out for Jeremy Corbyn rallies in West Yorkshire (From Lancaster And Morecambe Citizen),nhs-cyber-attack
"Trusts sent IT security patch that would have protected them, says NHS Digital",nhs-cyber-attack
Health trust invites users to board meeting,nhs-cyber-attack
Jeremy Corbyn vows NHS ‘for the many’ with package of health reforms (From Swindon Advertiser),nhs-cyber-attack
The Duchess of Cornwall announces visit to Oxford cancer centre (From The Oxford Times),nhs-cyber-attack
Legal & General - Thought leadership,nhs-cyber-attack
IT expert Marcus Hutchins: I was just ‘doing my bit’ to stop hackers (From Sutton Guardian),nhs-cyber-attack
Dame Joan Collins hits out at top designers targeting young children (From Southend Standard),nhs-cyber-attack
A&E restrictions lifted after cyber attack on NHS (From Stourbridge News),nhs-cyber-attack
Thousands turn out for Jeremy Corbyn rallies in West Yorkshire (From Wiltshire Times),nhs-cyber-attack
Q&A: What does Labour’s ‘fair taxation scheme’ mean? (From Penarth Times),nhs-cyber-attack
Cyber attack ‘accidental hero’ fears for his safety (From Lancashire Telegraph),nhs-cyber-attack
Jeremy Corbyn sets out Labour manifesto promising a ‘better future’ (From This Is Local London),nhs-cyber-attack
Theresa May gets mixed reaction from voters on the campaign trail (From The Westmorland Gazette),nhs-cyber-attack
Election day ahead: Jeremy Corbyn to launch Labour’s manifesto (From Wimbledon Guardian),nhs-cyber-attack
Rotherham Market event raises mental health awareness - Voluntary Action Rotherham         :        Voluntary Action Rotherham,nhs-cyber-attack
Microsoft's Brad Smith attacks US government for 'stockpiling' vulnerabilities after ransomware attack - Business Insider,nhs-cyber-attack
Moors Murderer Ian Brady dies aged 79 following illness (From Kidderminster Shuttle),nhs-cyber-attack
Theresa May woos Labour voters with pledges on workers’ rights (From This Is Local London),nhs-cyber-attack
Jeremy Corbyn vows NHS ‘for the many’ with package of health reforms (From Milford Mercury),nhs-cyber-attack
Tees GP systems back online after hack attack - but visits to A&E should still only be in emergency,nhs-cyber-attack
Experts probe potential link of ransomware cyber attack to North Korea (From Swindon Advertiser),nhs-cyber-attack
Community health service Provide operating normally after concerns over NHS cyber attack (From Braintree and Witham Times),nhs-cyber-attack
Jeremy Corbyn sets out Labour manifesto promising a ‘better future’ (From Chorley Citizen),nhs-cyber-attack
Normal service now resuming at Borders health centres hit by cyber attacks - The Southern Reporter,nhs-cyber-attack
Dame Joan Collins hits out at top designers targeting young children (From The Oxford Times),nhs-cyber-attack
Test developed to identify people with 'face blindness' « Guernsey Press,nhs-cyber-attack
Microsoft chief: Cyber attack ‘wake-up call for governments’ (From Knutsford Guardian),nhs-cyber-attack
Cyber attack hero ‘fears more for privacy than personal safety’ (From Wandsworth Guardian),nhs-cyber-attack
Labour’s ‘programme of hope’ to be paid for with new taxes and borrowing (From Stroud News and Journal),nhs-cyber-attack
IT expert Marcus Hutchins: I was just ‘doing my bit’ to stop hackers (From Braintree and Witham Times),nhs-cyber-attack
Funny all the Brexiters are firm on the SM but a bit vag...,nhs-cyber-attack
I will tell you honestly Danny... I look at UK Politics ...,nhs-cyber-attack
WannaCrypt: Protect your business against ransomware | SME Magazine,nhs-cyber-attack
NHS declared 'open for business' as crippling cyber attack finally brought under control | London Evening Standard,nhs-cyber-attack
Running Windows? How to protect against the big ransomware attack,nhs-cyber-attack
"European, Asian companies short on cyber insurance before ransomware attack",nhs-cyber-attack
NHS Fife   - Deaf Awareness Week - New Resources,nhs-cyber-attack
Jeremy Corbyn sets out Labour manifesto promising a ‘better future’ (From Evesham Journal),nhs-cyber-attack
It is not in crisis. You should be ashamed of yourself f...,nhs-cyber-attack
Consultation into North Staffordshire's community hospitals is delayed due to General Election,nhs-cyber-attack
Iwade Health Centre is without GPs again,nhs-cyber-attack
Theresa May woos Labour voters with pledges on workers’ rights (From Bicester Advertiser),nhs-cyber-attack
Reading Green Party | Greens select candidates for Reading West and Wokingham,nhs-cyber-attack
"New NHS plans fail to focus on children's health needs, leading doctors warn",nhs-cyber-attack
Where's Jeremy Hunt? 'You're more likely to see Shergar' as Health Secretary goes to ground after NHS cyber attack - Mirror Online,nhs-cyber-attack
Jeremy Corbyn vows NHS ‘for the many’ with package of health reforms (From Romsey Advertiser),nhs-cyber-attack
Cyber attack hero ‘fears more for privacy than personal safety’ (From Cotswold Journal),nhs-cyber-attack
Moors Murderer Ian Brady dies aged 79 following illness (From St Albans & Harpenden Review),nhs-cyber-attack
Health trust admits care delays put 22 cancer patients at risk - Spalding Guardian,nhs-cyber-attack
Jeremy Corbyn sets out Labour manifesto promising a ‘better future’ (From Middlewich Guardian),nhs-cyber-attack
Moors Murderer Ian Brady dies aged 79 following illness (From Chorley Citizen),nhs-cyber-attack
"Trusts sent IT security patch that would have protected them, says NHS Digital (From Surrey Comet)",nhs-cyber-attack
Britain worked through night to counter cyber attack on health service - minister,nhs-cyber-attack
Jamie and Rebekah Vardy rush baby son Finley to hospital after he developed shingles on his head Do you want to automatically post your MailOnline comments to your Facebook Timeline? Do you want to automatically post your MailOnline comments to your Facebo,nhs-cyber-attack
Cyber attack hero ‘fears more for privacy than personal safety’ (From Gazette & Herald),nhs-cyber-attack
Cyber attack on the NHS explained by expert - The Buteman,nhs-cyber-attack
Monday briefing: Just when you thought it was safe to log back on ...,nhs-cyber-attack
It wasn't necessary - So are you saying Privatisation is...,nhs-cyber-attack
Cyber attack hero ‘fears more for privacy than personal safety’ (From Redditch Advertiser),nhs-cyber-attack
Experts probe potential link of ransomware cyber attack to North Korea (From Hereford Times),nhs-cyber-attack
Jeremy Corbyn sets out Labour manifesto promising a ‘better future’ (From Droitwich Advertiser),nhs-cyber-attack
NHS hack could be about to become far worse as people switch on computers after weekend | The Independent,nhs-cyber-attack
Theresa May gets mixed reaction from voters on the campaign trail (From Basingstoke Gazette),nhs-cyber-attack
Rotherham College student wins NHS volunteer award - Rotherham College,nhs-cyber-attack
A&E restrictions lifted after cyber attack on NHS (From Bucks Free Press),nhs-cyber-attack
"We will never close Keith Bennett case despite Ian Brady’s death, police say (From Bucks Free Press)",nhs-cyber-attack
Jeremy Corbyn sets out Labour manifesto promising a ‘better future’ (From Barry And District News),nhs-cyber-attack
Corbyn hijacks May’s Facebook Live event to issue TV debate challenge (From South Wales Guardian),nhs-cyber-attack
Election day ahead: PM on workers’ rights as Corbyn pledges NHS cash (From Redditch Advertiser),nhs-cyber-attack
Election day ahead: Jeremy Corbyn to launch Labour’s manifesto (From Campaign Series),nhs-cyber-attack
Election day ahead: PM on workers’ rights as Corbyn pledges NHS cash (From Andover Advertiser),nhs-cyber-attack
Cyber attack hero ‘fears more for privacy than personal safety’ (From Runcorn and Widnes World),nhs-cyber-attack
Experts probe potential link of ransomware cyber attack to North Korea (From Hampshire Chronicle),nhs-cyber-attack
Microsoft chief: Cyber attack ‘wake-up call for governments’ (From Runcorn and Widnes World),nhs-cyber-attack
Corbyn hijacks May’s Facebook Live event to issue TV debate challenge (From Croydon Guardian),nhs-cyber-attack
Colchester General Hospital hosts showcase to get people into careers in healthcare (From Harwich and Manningtree Standard),nhs-cyber-attack
Wyre Forest hopeful says Corbyn’s vision will benefit the area (From Halesowen News),nhs-cyber-attack
"Warwick House Medical Centre, Upper Holway Road, Taunton hit by cyber attack (From This is The West Country)",nhs-cyber-attack
Election day ahead: Jeremy Corbyn to launch Labour’s manifesto (From Oxford Mail),nhs-cyber-attack
Thousands turn out for Jeremy Corbyn rallies in West Yorkshire (From Knutsford Guardian),nhs-cyber-attack
Election day ahead: Jeremy Corbyn to launch Labour’s manifesto (From South Wales Argus),nhs-cyber-attack
USA says Syria is killing prisoners and burning bodies in crematorium | Metro News,nhs-cyber-attack
"Nicola Sturgeon said ten years of SNP has been ""decade of delivery"" for Scotland",nhs-cyber-attack
Theresa May gets mixed reaction from voters on the campaign trail (From Redhill And Reigate Life),nhs-cyber-attack
Ex-UK spy chief slaps Microsoft over mass cyberattack – POLITICO,nhs-cyber-attack
Labour pledging £48bn extra spending to create ‘fairer society for the many’ (From Braintree and Witham Times),nhs-cyber-attack
"New NHS plans fail to focus on children's health needs, leading doctors warn - Spalding Guardian",nhs-cyber-attack
Seven hospitals affected by cyber attack still in need of support (From Impartial Reporter),nhs-cyber-attack
Sick Dungannon child travelling for vital operation left stranded at airport - Derry Journal,nhs-cyber-attack
Election day ahead: PM on workers’ rights as Corbyn pledges NHS cash (From This Is Local London),nhs-cyber-attack
"""Surge Of Patients"" Create '16 Hour Wait' At Wrexham Maelor A&E - Wrexham.com Wrexham.com",nhs-cyber-attack
"Moors murderer Ian Brady, 79, on brink of death as fiend receives end-of-life care at secure hospital and is urged to finally reveal burial site of victim Keith Bennett",nhs-cyber-attack
Experts probe potential link of ransomware cyber attack to North Korea (From Bradford Telegraph and Argus),nhs-cyber-attack
Patients warned to expect delays at Nuneaton's hospital after cyber attack,nhs-cyber-attack
Election day ahead: PM on workers’ rights as Corbyn pledges NHS cash (From Ledbury Reporter),nhs-cyber-attack
Health professionals are ‘discriminating against terminally ill LGBT people’ says Marie Curie · PinkNews,nhs-cyber-attack
Labour’s ‘programme of hope’ to be paid for with new taxes and borrowing (From Halesowen News),nhs-cyber-attack
UPDATED: Outpatient appointments WILL go ahead at Colchester General Hospital tomorrow (From Gazette),nhs-cyber-attack
Theresa May gets mixed reaction from voters on the campaign trail (From Watford Observer),nhs-cyber-attack
Hunt jealous of hackers who were able to cripple NHS in just 20 minutes,nhs-cyber-attack
NHS Grampian 'cannot meet 12-week planned surgery timescale',nhs-cyber-attack
Experts probe potential link of ransomware cyber attack to North Korea (From Salisbury Journal),nhs-cyber-attack
Airedale named one of country's 40 top-performing hospitals (From Craven Herald),nhs-cyber-attack
Dr Saif Abed Talks about the WannaCry Attack,nhs-cyber-attack
Top ten stories from Britain and around the world: Ian Brady dies aged 79 and Corbyn vows radical and responsible Labour Government - Liverpool Echo,nhs-cyber-attack
LETTERS ROUND-UP: The NHS...Spithead memories...Cycle lanes don't work...Beckfield reunion...,nhs-cyber-attack
Corbyn hijacks May’s Facebook Live event to issue TV debate challenge (From Burnham and Highbridge Weekly News),nhs-cyber-attack
This is the breed of dog that is most likely to attack you  | Devon Live,nhs-cyber-attack
Thousands turn out for Jeremy Corbyn rallies in West Yorkshire (From Croydon Guardian),nhs-cyber-attack
Quit smoking to save the NHS: Treating smokers costs THIS much every year,nhs-cyber-attack
NSSN 341: CWU members walk out to force Royal Mail back! | National Shop Stewards Network,nhs-cyber-attack
Moors Murderer Ian Brady dies aged 79 following illness (From Andover Advertiser),nhs-cyber-attack
‘Deserved’ pay rises for nurses and teachers if Lib Dems gain power (From South Wales Guardian),nhs-cyber-attack
Labour’s ‘programme of hope’ to be paid for with new taxes and borrowing (From Wirral Globe),nhs-cyber-attack
Four Winds pub owners One Red Ltd want to turn Falmouth site into care home | Cornwall Live,nhs-cyber-attack
Jeremy Corbyn vows NHS ‘for the many’ with package of health reforms (From Harrow Times),nhs-cyber-attack
Moors Murderer Ian Brady dies aged 79 following illness (From Echo),nhs-cyber-attack
IT expert Marcus Hutchins: I was just ‘doing my bit’ to stop hackers (From Wharfedale Observer),nhs-cyber-attack
Experts probe potential link of ransomware cyber attack to North Korea (From Banbury Cake),nhs-cyber-attack
A&E restrictions lifted after cyber attack on NHS (From Ledbury Reporter),nhs-cyber-attack
Labour pledging £48bn extra spending to create ‘fairer society for the many’ (From Sutton Guardian),nhs-cyber-attack
