title,story
A life: Hawking defied ALS to become pre-eminent physicist,stephen-hawking
"Stephen Hawking, best-known physicist of his time, has died",stephen-hawking
'May you keep flying like superman in microgravity': Tributes pour in for Stephen Hawking,stephen-hawking
Accomplished physicist Stephen Hawking dead at 76,stephen-hawking
Stephen Hawking: 'His laboratory was the universe',stephen-hawking
The Latest: CERN scientists hail Hawking's impact,stephen-hawking
"BC-EU--Obit-Stephen Hawk, 1509",stephen-hawking
Stephen Hawking leaves us with three important legacies,stephen-hawking
The Latest: Clinton saddened by Hawking's death,stephen-hawking
ISS Daily Summary Report – 3/14/2018 - NASA,stephen-hawking
Stephen Hawking and ALS: How was he able to live so long?,stephen-hawking
PM Modi condoles demise of Stephen Hawking,stephen-hawking
No One Is Impressed By Neymar's Stephen Hawking'Tribute',stephen-hawking
"Stephen Hawking discoveries: Origin of the universe, black holes behaviour and more",stephen-hawking
Theoretical physicist Stephen Hawking has died at 76,stephen-hawking
"Here's what Eddie Redmayne, who played Stephen Hawking in'The Theory of Everything,' said about his death",stephen-hawking
Professor Stephen Hawking tribute: 'An extraordinary man',stephen-hawking
From The Simpsons to Pink Floyd: Stephen Hawking in popular culture,stephen-hawking
Farmer Boys is testing out your willpower this St. Patrick’s Day with this scratcher game – San Gabriel Valley Tribune,stephen-hawking
National Geographic to Make Neil deGrasse Tyson's StarTalk Interview with Legendary Scientist Stephen Hawking Available for F...,stephen-hawking
Australian scientists pay tribute to Hawking | Mandurah Mail,stephen-hawking
"BBC Radio 2 - The Chris Evans Breakfast Show, Lord Andrew Lloyd Webber, Professor Brian Cox and Dental Hygiene",stephen-hawking
"Stephen Hawking dead: Theory of Everything director, Sundar Pichai react to his death",stephen-hawking
7 things you didn't know about Stephen Hawking,stephen-hawking
Stephen Hawking Passes Away At 76 (WATCH) | Karen Sharp | KOST 103.5,stephen-hawking
BBC Radio 4 - The Hitchhiker's Guide to the Galaxy - Seven reasons we love Stephen Hawking,stephen-hawking
The Latest: Queen sends condolence to Hawking's family,stephen-hawking
A life: Hawking defied ALS to become pre-eminent physicist,stephen-hawking
INGLES: Reactions to the death of physicist Stephen Hawking,stephen-hawking
Bus carrying Texas students from Disney World trip crashes into Alabama ravine,stephen-hawking
"Wereldberoemd wetenschapper Stephen Hawking is overleden. Van over heel de wereld komen er reacties op zijn dood. Verslagen reacties, maar vooral ook heel veel lof. Zo reageerde ruimtevaartorganisatie NASA op het",stephen-hawking
Stephen Hawking: 'His laboratory was the universe',stephen-hawking
The Latest: Queen sends condolence to Hawking's family,stephen-hawking
"Stephen Hawking, best-known physicist of his time, has died - News - The Independent - Massillon, OH",stephen-hawking
"Stephen Hawking, physicist who roamed the cosmos from a wheelchair, dies aged 76",stephen-hawking
Stephen Hawking: 'His laboratory was the universe' | Tennessee,stephen-hawking
Stephen Hawking was proof all life is precious and has meaning,stephen-hawking
"Stephen Hawking, traveller of a universe, passed during 76",stephen-hawking
Stephen Hawking: 'His laboratory was the universe',stephen-hawking
"Professor Stephen Hawking dies, aged 76 | Campbelltown-Macarthur Advertiser",stephen-hawking
"Physicist Stephen Hawking, who conquered the stars, dies at 76",stephen-hawking
"Stephen Hawking Dies: Katy Perry, 'Big Bang Theory' Cast & More React | Z104.3",stephen-hawking
Professor Stephen Hawking tribute: 'An extraordinary man',stephen-hawking
"Obituary: Stephen Hawking, the physicist whose vision of humanity's place in the universe captivated millions across the world | 1 NEWS NOW | TVNZ",stephen-hawking
Stephen Hawking hailed as 'extraordinary'by International Paralympic Committee president,stephen-hawking
"Stephen Hawking, Theoretical Physicist and Author, Dies at 76",stephen-hawking
Disagreement With Israeli Physicist Over Black Holes Led to Stephen Hawking’s Greatest Discovery,stephen-hawking
Instapundit  » Blog Archive   » RIP: Stephen Hawking dies aged 76 peacefully at his home — 55 years after the world-famous physicis…,stephen-hawking
'May you keep flying like superman in microgravity': Tributes pour in for Stephen Hawking,stephen-hawking
Professor Stephen Hawking - the world famous English physicist dies at 76,stephen-hawking
Some people are angry about how the media is covering Stephen Hawking,stephen-hawking
A life: Hawking defied ALS to become celebrated physicist,stephen-hawking
The Latest: CERN scientists hail Hawking's impact,stephen-hawking
Telescopes on the Moon Will Let Astronomers See the Earliest Moments of the Universe in Stunning Detail,stephen-hawking
Tributes to the brilliant Stephen Hawking flood social media,stephen-hawking
BRITAIN STEPHEN HAWKING OBIT,stephen-hawking
One pervading mystery for Stephen Hawking: women | Penarth Times,stephen-hawking
A brief history of Stephen Hawking’s atheism,stephen-hawking
"Hawking's death, Einstein's birth, and Pi Day: what does it all mean?",stephen-hawking
The Latest: Actor Eddie Redmayne pays tribute to Hawking,stephen-hawking
Scientist Stephen Hawking has died aged 76,stephen-hawking
Stephen Hawking dies peacefully aged 76 after battling motor neurone disease for decades | London Evening Standard,stephen-hawking
Benedict Cumberbatch on Professor Stephen Hawking: I will miss our margaritas | Epsom Guardian,stephen-hawking
"'May you keep flying like superman in microgravity': Tributes pour in for physicist Stephen Hawking, dead at 76",stephen-hawking
"Eddie Redmayne, 'Big Bang Theory'cast lead stars'tributes to Stephen Hawking",stephen-hawking
Stephen Hawking dies: 5 things to know about the legendary physicist,stephen-hawking
The Latest: Clinton saddened by Hawking’s death,stephen-hawking
Stephen Hawking: a glimpse into his groundbreaking work,stephen-hawking
There's a Stephen Hawking Snapchat filter... which is how some users learned of his death,stephen-hawking
Stephen Hawking had ALS. What is it? A look at the motor neuron disease,stephen-hawking
Theoretical physicist Stephen Hawking has died at 76 - seattlepi.com,stephen-hawking
Stephen Hawking: Reaction to his death,stephen-hawking
Scientist Stephen Hawking has died aged 76,stephen-hawking
Stephen Hawking recently said he knows what happened before the Big Bang. Other times he blew our minds,stephen-hawking
"Stephen Hawking dies at 76, family spokesman says",stephen-hawking
Family spokesman: Physicist Stephen Hawking dead at age 76 | News | magicvalley.com,stephen-hawking
Stephen Hawking helped elevate Canada's science profile,stephen-hawking
"Stephen Hawking, tourist of the universe, dead at 76",stephen-hawking
Stephen Hawking gave more to humanity than science – changing perceptions of LGBT and disabled people,stephen-hawking
"Eddie Redmayne, 'Big Bang Theory'cast lead stars'tributes to Stephen Hawking",stephen-hawking
"Stephen Hawking, legendary theoretical physicist, dies at 76",stephen-hawking
A brief history of Stephen Hawking’s atheism,stephen-hawking
Perimeter Institute Mourns the Passing of Friend and Colleague Stephen Hawking,stephen-hawking
"How Do Iq Tests Work, What Is The Average Iq, What Is Mensa And What Was Stephen Hawking’s Intelligence Quotient?",stephen-hawking
Renowned Scientist Stephen Hawking Dead Aged 76,stephen-hawking
"Stephen Hawking, legendary physicist, dies at 76, family says",stephen-hawking
NASA's tribute to Stephen Hawking will make you smile like he did in microgravity,stephen-hawking
"Stephen Hawking dies, world loses its brightest star",stephen-hawking
Theoretical physicist Stephen Hawking has died at 76 - SFGate,stephen-hawking
Stephen Hawking dead at 76 | New York Post,stephen-hawking
Stephen Hawking: His most memorable quotations,stephen-hawking
"Hawking defied ALS to become pre-eminent physicist - News - The Patriot Ledger, Quincy, MA - Quincy, MA",stephen-hawking
The world reacts to the death of physicist Stephen Hawking,stephen-hawking
Zitate: Stephen Hawking | das BlogMagazin,stephen-hawking
Heaven 'is a fairy story': This is what Stephen Hawking says happens when people die,stephen-hawking
The world reacts to the death of physicist Stephen Hawking,stephen-hawking
"Stephen Hawking, legendary physicist, dies at 76, family says",stephen-hawking
Indians are so good at mathematics and physics: Stephen Hawking in India,stephen-hawking
Stephen Hawking had ALS. What is it? A look at the motor neuron disease,stephen-hawking
Stephen Hawking has died aged 76,stephen-hawking
The Investigators,stephen-hawking
"Professor Stephen Hawking dies, aged 76",stephen-hawking
The Latest: Vatican astronomy official hails Hawking,stephen-hawking
Renowned physicist Stephen Hawking has died | Dalby Herald,stephen-hawking
Stephen Hawking: His most memorable quotations,stephen-hawking
"Felicity Jones on Playing Jane, Wife of Hawking",stephen-hawking
"Stephen Hawking On Alien Life, Extraterrestrials and the Possibility of UFOs Visiting Earth",stephen-hawking
Brad Tucker pays tribute to the late Stephen Hawking,stephen-hawking
Theoretical physicist Stephen Hawking has died at 76,stephen-hawking
Pioneering physicist Stephen Hawking dies at 76,stephen-hawking
Weather & Traffic,stephen-hawking
"Stephen Hawking, physicist who came to symbolize the power of the human mind, dies at 76",stephen-hawking
Microsoft lawsuit notes 1 of 118 gender bias complaints,stephen-hawking
A life: Hawking defied ALS to become pre-eminent physicist,stephen-hawking
Stephen Hawking was proof all life is precious and has meaning,stephen-hawking
Stephen Hawking had ALS. What is it? A look at the motor neuron disease,stephen-hawking
World farewells Stephen Hawking,stephen-hawking
UK Expels Russian Diplomats - 23 have a week to get out | YNUKtvYNUKtv,stephen-hawking
A Look at Stephen Hawking’s Net Worth and His Extraordinary Legacy,stephen-hawking
"Stephen Hawking, the man Stephen Hawking and you",stephen-hawking
Stephen Hawking: 'His laboratory was the universe',stephen-hawking
10 Investigates Community,stephen-hawking
$3.13 margaritas for Chili's birthday March 13,stephen-hawking
"Stephen Hawking, tourist of the universe, dead at 76",stephen-hawking
"Stephen Hawking quotes: 'Occasionally, I find an answer'",stephen-hawking
A brief explanation of three of Stephen Hawking’s scientific breakthroughs | Redhill And Reigate Life,stephen-hawking
'One of the World's Most Brilliant Minds' - Cambridge Pays Tribute to Stephen Hawking,stephen-hawking
"Mourners Honor Stephen Hawking, Whose Mind Blazed Bright",stephen-hawking
ALS: The Disease That Stephen Hawking Defied For Decades,stephen-hawking
Stephen Hawking: 'His laboratory was the universe',stephen-hawking
Stephen Hawking: 'His laboratory was the universe',stephen-hawking
5 things you need to know Wednesday,stephen-hawking
Stephen Hawking: ‘His laboratory was the universe’,stephen-hawking
"Theresa May must get a grip on the NHS, Corbyn urges | Braintree and Witham Times",stephen-hawking
Stephen Hawking's impact on culture helped'geekery enter mass media': experts,stephen-hawking
"Stephen Hawking, best-known physicist of his time, has died Stephen Hawking, best-known physicist of his time, has died Stephen Hawking, best-known physicist of his time, has died",stephen-hawking
Stephen Hawking Showed the Power of an Unconstrained Mind,stephen-hawking
The Latest: Queen sends condolence to Hawking's family,stephen-hawking
"'Star Trek'to'Simpsons,' Hawking was a pop-culture physicist",stephen-hawking
Stephen Hawking: A Brief History Of Genius,stephen-hawking
Glen Hansard terrific with and without the Los Angeles Philharmonic at Disney Hall on Sunday – San Gabriel Valley Tribune,stephen-hawking
Hawking was a source of inspiration for students in Dubai,stephen-hawking
Stephen Hawking has died aged 76,stephen-hawking
"The Progress We've Made Fighting ALS, the Disease Stephen Hawking Suffered From",stephen-hawking
Black holes dissolving like aspirin: How Hawking changed physics,stephen-hawking
Professor Stephen Hawking tribute: 'An extraordinary man',stephen-hawking
AP News in Brief at 6:02 a.m. EDT,stephen-hawking
"5 Things for March 14: Student walkout, Pennsylvania race, Trump, Stephen Hawking",stephen-hawking
The social media campaign that threw motor neurone disease into the spotlight | Bournemouth Echo,stephen-hawking
Professor Stephen Hawking praised NHS and battled Health Secretary Jeremy Hunt,stephen-hawking
"Stephen Hawking, best-known physicist of his time, has died",stephen-hawking
Professor Stephen Hawking Dies At The Age Of 76,stephen-hawking
The world reacts to the death of physicist Stephen Hawking,stephen-hawking
"Hawking, the greatest physicist since Einstein, never won the Nobel",stephen-hawking
Walmart to Expand Grocery Delivery as Amazon Battle Intensifies,stephen-hawking
The Universe According To Albert Einstein: Relativity,stephen-hawking
"Billionaire signs up to be killed, have brain digitally preserved | New York Post",stephen-hawking
The Latest: Stephen Hawking praised as an inspiration,stephen-hawking
astrophysicists: A big thinkers of our time: Stephen Hawking has died,stephen-hawking
Stephen Hawking died on a day that is cosmically connected to Albert Einstein and Pi,stephen-hawking
Renowned Physicist Stephen Hawking Has Died,stephen-hawking
"Physicist Stephen Hawking Dead At 76, Says Family Spokesman",stephen-hawking
"""In my mind I am free"": Notable quotes from Stephen Hawking",stephen-hawking
BRITAIN STEPHEN HAWKING OBIT,stephen-hawking
The Latest: Stephen Hawking praised as an inspiration,stephen-hawking
NASA Honors Legacy of Renowned Astrophysicist Stephen Hawking,stephen-hawking
The Latest: Swedish academy pays tribute to Hawking,stephen-hawking
Famed Physicist Stephen Hawking Dead At 76,stephen-hawking
Lack of evidence put Hawking's Nobel hopes in black hole,stephen-hawking
Stephen Hawking dies at 76,stephen-hawking
Neymar mocked for hugely insensitive tribute to Stephen Hawking,stephen-hawking
Professor Stephen Hawking dead at 76,stephen-hawking
The Latest: Stephen Hawking praised as an inspiration,stephen-hawking
Remembering Stephen Hawking: 5 things to know about the legendary physicist,stephen-hawking
"Farhan Akhtar, Diana Penty, Sayami Kher Offer Their Heartfelt Condolences To Stephen Hawking – Check Tweet",stephen-hawking
"Stephen Hawking, best-known physicist of his time, has died",stephen-hawking
Stephen Hawking: The man who made astro-physics understandable,stephen-hawking
The Latest: Actor Eddie Redmayne pays tribute to Hawking,stephen-hawking
"Professor Stephen Hawking dies, aged 76 | Central Western Daily",stephen-hawking
"""Hawking chciał przejechać po palcach Margaret Thatcher""",stephen-hawking
‘An inspiration to all of us’: Professor Stephen Hawking dies aged 76,stephen-hawking
Stephen Hawking has died aged 76,stephen-hawking
Ap Politics BREAKING: Stephen Hawking took his last breath aged 76,stephen-hawking
The Latest: Stephen Hawking praised as an inspiration,stephen-hawking
Theoretical physicist Stephen Hawking dies,stephen-hawking
ALS: The disease that Stephen Hawking defied for decades,stephen-hawking
Stephen Hawking dies at 76,stephen-hawking
"Physicist Stephen Hawking, who unlocked the secrets of space and time, dies at 76 | Reuters",stephen-hawking
Hawking helped elevate Canada's science profile | CTV Toronto News,stephen-hawking
Some of Stephen Hawking's publications,stephen-hawking
Famed physicist Stephen Hawking dies 55 years after being given 2 years to live,stephen-hawking
Professor Hawking was ‘inspiration to millions’ – University of Cambridge | Wandsworth Guardian,stephen-hawking
Hawking’s complicated private life,stephen-hawking
Lack of evidence put Hawking's Nobel hopes in black hole,stephen-hawking
"Stephen Hawking, legendary physicist, dies at 76, family says",stephen-hawking
Popular physicist Stephen Hawking dies at 76,stephen-hawking
A brief history of Stephen Hawking’s ‘A Brief History of Time’,stephen-hawking
"Stephen Hawking, tourist of the universe, dead at 76",stephen-hawking
Stephen Hawking: A brief history of genius,stephen-hawking
Stephen Hawking: 'His laboratory was the universe',stephen-hawking
"Stephen Hawking playing poker with Newton, Einstein and Data",stephen-hawking
"Mourners Honor Stephen Hawking, Whose Mind Blazed Bright",stephen-hawking
Renowned physicist Stephen Hawking dies | Sky News Australia,stephen-hawking
Stephen Hawking Passed Away: PM Narendra Modi Condoles Demise of Cosmologist,stephen-hawking
These 15 photos show how Stephen Hawking defied his disability and lived an incredible life,stephen-hawking
"PM Narendra Modi condoles demise of Stephen Hawking; says his grit, tenacity inspired people all over the world",stephen-hawking
"Theresa May must get a grip on the NHS, Corbyn urges | Surrey Comet",stephen-hawking
Stephen Hawking dies at age of 76,stephen-hawking
Q&A with Stephen Hawking,stephen-hawking
"16 Inspirational Stephen Hawking Quotes About Life, the Universe and More",stephen-hawking
"Stephen Hawking, Tourist of the Universe, Dead at 76",stephen-hawking
A life: Hawking defied ALS to become pre-eminent physicist A life: Hawking defied ALS to become pre-eminent physicist A life: Hawking defied ALS to become pre-eminent physicist,stephen-hawking
Fans anger as Neymar’s ‘tribute’ to Stephen Hawking spectacularly backfires,stephen-hawking
Stephen Hawking: How he made his mark on popular culture,stephen-hawking
Professor Stephen Hawking dies aged 76 | Your Local Guardian,stephen-hawking
"Travel Through Time To Experience The Year 2050 With DREAM THE FUTURE, The Mind-Blowing Documentary Series Premiering On CuriosityStream March 15",stephen-hawking
"Syfy, Discovery, Science Channel to Pay Tribute to Stephen Hawking | Multichannel",stephen-hawking
A life: Hawking defied ALS to become pre-eminent physicist,stephen-hawking
Stephen Hawking warned about dangers of artificial intelligence | The Oxford Times,stephen-hawking
Famed physicist Stephen Hawking dies at age 76 - KPTV - FOX 12,stephen-hawking
The Latest: CERN scientists hail Hawking's impact,stephen-hawking
Prince George's police passion,stephen-hawking
Stephen Hawking dies: Twitter pays tribute to celebrated physicist,stephen-hawking
Fille: Happy Pi Day! – Maman & Fille,stephen-hawking
Most read Most read,stephen-hawking
"What is ALS, the condition Stephen Hawking lived with for over 5 decades?",stephen-hawking
Mamata condoles death of Stephen Hawking,stephen-hawking
"Eddie Redmayne, 'Big Bang Theory'cast lead stars'tributes to Stephen Hawking",stephen-hawking
Eddie Redmayne: Professor Hawking the funniest man I ever met | Harrow Times,stephen-hawking
"Travel Through Time To Experience The Year 2050 With DREAM THE FUTURE, The Mind-Blowing Documentary Series Premiering On CuriosityStream March 15",stephen-hawking
"The complicated but beautiful love story between Stephen Hawking and his first wife, Jane.",stephen-hawking
A brief history of Stephen Hawking’s atheism,stephen-hawking
Eddie Redmayne mourns Stephen Hawking,stephen-hawking
"World renowned physicist, Stephen Hawking dies",stephen-hawking
Stephen Hawking wasn't one to shy away from guest roles in Hollywood,stephen-hawking
Also in the news,stephen-hawking
"Theoretical physicist Stephen Hawking dead at 76, family spokesman says - One News Page",stephen-hawking
Stephen Hawking helped elevate Canada's science profile,stephen-hawking
The Latest: Clinton saddened by Hawking's death Related More>> MORE Additional Links Poll Science & technology news Most Popular Lo Más Popular AP National News Video,stephen-hawking
Stephen Hawking's advice for a fulfilling career,stephen-hawking
Stephen Hawking dies at 76: ‘His laboratory was the universe' Stephen Hawking dies at 76: ‘His laboratory was the universe' Stephen Hawking dies at 76: ‘His laboratory was the universe',stephen-hawking
7 things about Stephen Hawking you may have wondered about,stephen-hawking
Stephen Hawking left memorable impact through TV cameos,stephen-hawking
Tributes to the brilliant Stephen Hawking flood social media,stephen-hawking
Eddie Redmayne calls Stephen Hawking 'a truly beautiful mind.',stephen-hawking
"Stephen Hawking, best-known physicist of his time, has died Stephen Hawking, best-known physicist of his time, has died",stephen-hawking
"Stephen Hawking, tourist of the universe, dead at 76",stephen-hawking
"Stephen Hawking, best-known physicist of his time, has died",stephen-hawking
Stephen Hawking dies at the age of 76 – Press Association,stephen-hawking
INFOGRAPHIC – Hawking dedicated life to solving mysteries of universe | Alaturka,stephen-hawking
"Katy Perry, Macaulay Culkin and Eddie Redmayne are among celebrities paying tribute to Stephen Hawking",stephen-hawking
The man who helped Stephen Hawking achieve his lifelong dream of experiencing zero gravity remembers what it was like to watch the acclaimed physicist break free of his wheelchair,stephen-hawking
Capita plans to cut reliance on UK market,stephen-hawking
"Eddie Redmayne, 'Big Bang Theory'cast lead stars'tributes to Stephen Hawking",stephen-hawking
Theoretical physicist Stephen Hawking has died at 76 - news - att.net,stephen-hawking
Eddie Redmayne Remembers Stephen Hawking As A ‘Truly Beautiful Mind’,stephen-hawking
Edinburgh News.Net - Renowned Physicist Stephen Hawking dies at home in England,stephen-hawking
How Stephen Hawking built a sound system at 15 to foster his love of classical music | Classical MPR,stephen-hawking
The Latest: CERN scientists hail Hawking's impact,stephen-hawking
10 Things to Know for Today,stephen-hawking
Some of Stephen Hawking's publications,stephen-hawking
The Latest: CERN scientists hail Hawking's impact,stephen-hawking
9 famous quotes of Stephen Hawking,stephen-hawking
Stephen Hawking passes away at 76: Indian scientists remember the man who defied odds to unlock the secrets of space and time - Firstpost,stephen-hawking
"Eddie Redmayne, 'Big Bang Theory'cast lead stars'tributes to Stephen Hawking",stephen-hawking
"What is ALS, the condition Stephen Hawking lived with for over 5 decades?",stephen-hawking
Intellectual vacuum left in the wake: Stephen Hawkings dies at 76,stephen-hawking
Madonna to helm Michaela DePrince biopic Taking Flight,stephen-hawking
kcentv.com | PHOTOS: Remembering Stephen Hawking,stephen-hawking
Stephen Hawking’s Family: 5 Fast Facts You Need to Know,stephen-hawking
Housing guideline launched for disaster prone rural areas - The Bangladesh Today,stephen-hawking
"Facebook bans anti-Muslim group Britain First, its leaders – East Bay Times",stephen-hawking
"Kovind, Modi mourn Hawking",stephen-hawking
The world reacts to death of Visionary Physicist Stephen Hawking,stephen-hawking
"Physicist Stephen Hawking, Who Conquered the Stars, Dies at 76",stephen-hawking
Remembering Stephen Hawking: 5 things to know about the legendary physicist,stephen-hawking
Brilliant Scientist Stephen Hawking Dies At 76,stephen-hawking
Stephen Hawking Passes Away: Did The Genius Believe in God?,stephen-hawking
"Stephen Hawking, legendary physicist, dies at 76, family says",stephen-hawking
Amitabh Bachchan gets go ahead for 'Thugs of Hindostan'action scene,stephen-hawking
Stephen Hawking: A brief history of genius,stephen-hawking
Pearls of wisdom from Stephen Hawking,stephen-hawking
Lack of evidence put Hawking's Nobel hopes in black hole,stephen-hawking
7 things you didn't know about Stephen Hawking,stephen-hawking
"Mourners Honor Stephen Hawking, Whose Mind Blazed Bright",stephen-hawking
"Watch Now on Sunrise: Cold Pi Day, Stephen Hawking Dies, Marty Simmons Out?",stephen-hawking
Broadcom Will Abandon Attempt to Acquire Qualcomm,stephen-hawking
"Brilliant, popular physicist Stephen Hawking dies at 76",stephen-hawking
Stephen Hawking: His most memorable quotations,stephen-hawking
Rajya Sabha proceedings stalled again as protests continue,stephen-hawking
Stephen Hawking a celebrity face of modern physics: Rahul Gandhi,stephen-hawking
How Stephen Hawking predicted time travel and a robot apocalypse,stephen-hawking
Texas Republican mocks Stephen Hawking after his death -- and gets obliterated by his colleagues,stephen-hawking
Scientist Stephen Hawking dead at age 76,stephen-hawking
"Katy Perry kissed a boy on 'American Idol,' and he didn’t like it | The Peak",stephen-hawking
Hawking’s final message to world | Gladstone Observer,stephen-hawking
(FILE) GERMANY STEPHEN HAWKING OBIT,stephen-hawking
Stephen Hawking dies at 76,stephen-hawking
Quotations from Stephen Hawking,stephen-hawking
From The Simpsons to Pink Floyd: Stephen Hawking in popular culture,stephen-hawking
Physicist Stephen Hawking has died aged 76 - Unexplained Mysteries,stephen-hawking
Stephen Hawking net worth: How much was the science genius worth? | UK | News | Express.co.uk,stephen-hawking
"Stephen Hawking, best-known physicist of his time, has died",stephen-hawking
Professor Stephen Hawking dies: Family announces death,stephen-hawking
11 Quotes By Stephen Hawking That Changed Our Perceptions About Life,stephen-hawking
Stephen Hawking has died aged 76 - newsR VIDEO,stephen-hawking
Health Politics,stephen-hawking
"BC-EU--Obit-Stephen Hawk, 1588",stephen-hawking
Stephen Hawking's final Reddit post was an ominous warning about the future of humanity and capitalism,stephen-hawking
How Stephen Hawking Predicted The World Would End,stephen-hawking
Cambridge students pay tribute to 'inspirational' Hawking,stephen-hawking
UK-2NDLD HAWKING - British scientist Stephen Hawking dies at his home aged 76,stephen-hawking
"TV Guide - Stephen Hawking's Greatest Big Bang Theory Moments - Entertainment - Wellington Daily News - Wellington, KS - Wellington, KS",stephen-hawking
